{
  "$schema": "https://json-schema.org/draft/2020-12/schema",
  "$id": "diagagent.result.schema.json",
  "title": "DiagAgent validation result",
  "type": "object",
  "properties": {
    "ic": {"type": ["number", "null"]},
    "icir": {"type": ["number", "null"]},
    "rank_ic": {"type": ["number", "null"]},
    "rank_icir": {"type": ["number", "null"]},
    "final_nav": {"type": ["number", "null"]},
    "total_return": {"type": ["number", "null"]},
    "annual_return": {"type": ["number", "null"]},
    "annual_volatility": {"type": ["number", "null"]},
    "max_drawdown": {"type": ["number", "null"]},
    "sharpe_ratio": {"type": ["number", "null"]},
    "calmar_ratio": {"type": ["number", "null"]},
    "sortino_ratio": {"type": ["number", "null"]},
    "win_rate": {"type": ["number", "null"]},
    "excess_annual_return": {"type": ["number", "null"]},
    "excess_annual_volatility": {"type": ["number", "null"]},
    "excess_max_drawdown": {"type": ["number", "null"]},
    "information_ratio": {"type": ["number", "null"]},
    "excess_calmar_ratio": {"type": ["number", "null"]},
    "excess_sortino_ratio": {"type": ["number", "null"]},
    "excess_win_rate": {"type": ["number", "null"]},
    "sell_turn_mean": {"type": ["number", "null"]},
    "buy_turn_mean": {"type": ["number", "null"]},
    "one_way_turnover_mean": {"type": ["number", "null"]},
    "holding_count_mean": {"type": ["number", "null"]},
    "optimizer_universe_count_mean": {"type": ["number", "null"]},
    "invested_weight_mean": {"type": ["number", "null"]},
    "n_periods": {"type": ["integer", "null"]}
  },
  "required": [
    "ic", "icir", "rank_ic", "rank_icir", "final_nav", "total_return",
    "annual_return", "annual_volatility", "max_drawdown", "sharpe_ratio",
    "calmar_ratio", "sortino_ratio", "win_rate", "excess_annual_return",
    "excess_annual_volatility", "excess_max_drawdown", "information_ratio",
    "excess_calmar_ratio", "excess_sortino_ratio", "excess_win_rate",
    "sell_turn_mean", "buy_turn_mean",
    "one_way_turnover_mean", "holding_count_mean",
    "optimizer_universe_count_mean", "invested_weight_mean", "n_periods"
  ],
  "additionalProperties": false
}
