{
  "ic": 0.026,
  "icir": 0.168,
  "rank_ic": 0.022,
  "rank_icir": 0.151,
  "final_nav": 1.136,
  "total_return": 0.136,
  "annual_return": 0.142,
  "annual_volatility": 0.120,
  "max_drawdown": -0.141,
  "sharpe_ratio": 1.180,
  "calmar_ratio": 1.010,
  "sortino_ratio": 1.690,
  "win_rate": 0.547,
  "excess_annual_return": 0.058,
  "excess_annual_volatility": 0.111,
  "excess_max_drawdown": -0.101,
  "information_ratio": 0.520,
  "excess_calmar_ratio": 0.574,
  "excess_sortino_ratio": 0.748,
  "excess_win_rate": 0.519,
  "sell_turn_mean": 0.036,
  "buy_turn_mean": 0.041,
  "one_way_turnover_mean": 0.039,
  "holding_count_mean": 64.200,
  "optimizer_universe_count_mean": 106.100,
  "invested_weight_mean": 0.998,
  "n_periods": 243
}
